{
  "scenario_version": 1,
  "operation": "compute_crush_assignment",
  "resource": "documents",
  "partitions": [
    "documents_0",
    "documents_1",
    "documents_2",
    "documents_3",
    "documents_4",
    "documents_5",
    "documents_6",
    "documents_7",
    "documents_8",
    "documents_9",
    "documents_10",
    "documents_11",
    "documents_12",
    "documents_13",
    "documents_14",
    "documents_15",
    "documents_16",
    "documents_17",
    "documents_18",
    "documents_19",
    "documents_20",
    "documents_21",
    "documents_22",
    "documents_23",
    "documents_24",
    "documents_25",
    "documents_26",
    "documents_27",
    "documents_28",
    "documents_29",
    "documents_30",
    "documents_31",
    "documents_32",
    "documents_33",
    "documents_34",
    "documents_35",
    "documents_36",
    "documents_37",
    "documents_38",
    "documents_39",
    "documents_40",
    "documents_41",
    "documents_42",
    "documents_43",
    "documents_44",
    "documents_45",
    "documents_46",
    "documents_47",
    "documents_48",
    "documents_49",
    "documents_50",
    "documents_51",
    "documents_52",
    "documents_53",
    "documents_54",
    "documents_55",
    "documents_56",
    "documents_57",
    "documents_58",
    "documents_59",
    "documents_60",
    "documents_61",
    "documents_62",
    "documents_63",
    "documents_64",
    "documents_65",
    "documents_66",
    "documents_67",
    "documents_68",
    "documents_69",
    "documents_70",
    "documents_71",
    "documents_72",
    "documents_73",
    "documents_74",
    "documents_75",
    "documents_76",
    "documents_77",
    "documents_78",
    "documents_79",
    "documents_80",
    "documents_81",
    "documents_82",
    "documents_83",
    "documents_84",
    "documents_85",
    "documents_86",
    "documents_87",
    "documents_88",
    "documents_89",
    "documents_90",
    "documents_91",
    "documents_92",
    "documents_93",
    "documents_94",
    "documents_95",
    "documents_96",
    "documents_97",
    "documents_98",
    "documents_99",
    "documents_100",
    "documents_101",
    "documents_102",
    "documents_103",
    "documents_104",
    "documents_105",
    "documents_106",
    "documents_107",
    "documents_108",
    "documents_109",
    "documents_110",
    "documents_111",
    "documents_112",
    "documents_113",
    "documents_114",
    "documents_115",
    "documents_116",
    "documents_117",
    "documents_118",
    "documents_119",
    "documents_120",
    "documents_121",
    "documents_122",
    "documents_123",
    "documents_124",
    "documents_125",
    "documents_126",
    "documents_127"
  ],
  "state_counts": [
    {
      "state": "LEADER",
      "count": 1
    },
    {
      "state": "STANDBY",
      "count": 2
    }
  ],
  "max_partitions_per_instance": -1,
  "instances": [
    {
      "name": "node-0-0",
      "domain": {
        "zone": "zone-0",
        "instance": "node-0-0"
      }
    },
    {
      "name": "node-0-1",
      "domain": {
        "zone": "zone-0",
        "instance": "node-0-1"
      }
    },
    {
      "name": "node-1-0",
      "domain": {
        "zone": "zone-1",
        "instance": "node-1-0"
      }
    },
    {
      "name": "node-1-1",
      "domain": {
        "zone": "zone-1",
        "instance": "node-1-1"
      }
    },
    {
      "name": "node-2-0",
      "domain": {
        "zone": "zone-2",
        "instance": "node-2-0"
      }
    },
    {
      "name": "node-2-1",
      "domain": {
        "zone": "zone-2",
        "instance": "node-2-1"
      }
    },
    {
      "name": "node-3-0",
      "domain": {
        "zone": "zone-3",
        "instance": "node-3-0"
      }
    },
    {
      "name": "node-3-1",
      "domain": {
        "zone": "zone-3",
        "instance": "node-3-1"
      }
    }
  ],
  "live_instances": [
    "node-0-0",
    "node-0-1",
    "node-1-0",
    "node-1-1",
    "node-2-0",
    "node-2-1",
    "node-3-0",
    "node-3-1"
  ],
  "topology": {
    "path": "/zone/instance",
    "fault_zone_type": "zone",
    "end_node_type": "instance"
  }
}
