{
  "scenario_version": 1,
  "operation": "select_transitions",
  "state_model": {"kind": "built_in", "name": "LeaderStandby"},
  "resource": {"name": "documents", "partitions": ["documents_0"]},
  "replicas": 3,
  "instances": [
    {"name": "node-a", "session_id": "session-a"},
    {"name": "node-b", "session_id": "session-b"},
    {"name": "node-c", "session_id": "session-c"}
  ],
  "live_instances": ["node-a", "node-b", "node-c"],
  "preference_lists": {"documents_0": ["node-a", "node-b", "node-c"]},
  "current_state": {
    "documents_0": {"node-a": "LEADER", "node-b": "OFFLINE", "node-c": "OFFLINE"}
  },
  "candidate_transitions": [
    {"partition": "documents_0", "instance": "node-b", "from": "OFFLINE", "to": "STANDBY"},
    {"partition": "documents_0", "instance": "node-c", "from": "OFFLINE", "to": "STANDBY"}
  ],
  "pending_transitions": []
}
