{
  "scenario_version": 1,
  "operation": "select_transitions",
  "state_model": {"kind": "built_in", "name": "LeaderStandby"},
  "resource": {"name": "documents", "partitions": ["documents_0", "documents_1"]},
  "replicas": 2,
  "instances": [
    {"name": "node-a", "session_id": "session-a"},
    {"name": "node-b", "session_id": "session-b"},
    {"name": "node-c", "session_id": "session-c"}
  ],
  "live_instances": ["node-a", "node-b", "node-c"],
  "preference_lists": {
    "documents_0": ["node-b", "node-a"],
    "documents_1": ["node-c", "node-b"]
  },
  "current_state": {
    "documents_0": {"node-a": "LEADER", "node-b": "STANDBY"},
    "documents_1": {"node-b": "STANDBY", "node-c": "STANDBY"}
  },
  "candidate_transitions": [
    {"partition": "documents_0", "instance": "node-a", "from": "LEADER", "to": "STANDBY"},
    {"partition": "documents_0", "instance": "node-b", "from": "STANDBY", "to": "LEADER"},
    {"partition": "documents_1", "instance": "node-c", "from": "STANDBY", "to": "LEADER"}
  ],
  "pending_transitions": []
}
